{
  "schema_version": "0.2.0",
  "thinker_id": "TH.PLATO",
  "profile_release": "TH.PLATO.PROFILE-0.1.0",
  "manifest_id": "TH.PLATO.MANIFEST.CORPUS.TEST_0_2_0",
  "corpus_release": "CORPUS-0.2.0-TEST",
  "status": "DRAFT",
  "created_at": "2026-10-04T21:00:00Z",
  "schema_refs": {
    "corpus": "0.2.1",
    "memory": "0.2.1",
    "provenance": "0.2.1"
  },
  "works": [
    "TH.PLATO.WORK.TEST"
  ],
  "artifacts": [
    {
      "artifact_id": "synthetic-work-catalog",
      "kind": "WORK_CATALOG",
      "path_or_ref": "fixtures/phase0/corpus/work.json",
      "sha256": "0000000000000000000000000000000000000000000000000000000000000000"
    },
    {
      "artifact_id": "synthetic-segments",
      "kind": "SEGMENTS",
      "path_or_ref": "fixtures/phase0/corpus/segment.json",
      "sha256": "1111111111111111111111111111111111111111111111111111111111111111"
    }
  ],
  "manifest_checksum": "2222222222222222222222222222222222222222222222222222222222222222",
  "parent_manifest_id": null,
  "notes": "Synthetic Phase 0 fixture only."
}
